"Entry"	"Entry.name"	"Status"	"Protein.names"	"Gene.names"	"Organism"	"Length"
"Q8NBQ5"	"DHB11_HUMAN"	"reviewed"	"Estradiol 17-beta-dehydrogenase 11 (EC 1.1.1.62) (17-beta-hydroxysteroid dehydrogenase 11) (17-beta-HSD 11) (17bHSD11) (17betaHSD11) (17-beta-hydroxysteroid dehydrogenase XI) (17-beta-HSD XI) (17betaHSDXI) (Cutaneous T-cell lymphoma-associated antigen HD-CL-03) (CTCL-associated antigen HD-CL-03) (Dehydrogenase/reductase SDR family member 8) (Retinal short-chain dehydrogenase/reductase 2) (retSDR2) (Short chain dehydrogenase/reductase family 16C member 2)"	"HSD17B11 DHRS8 PAN1B SDR16C2 PSEC0029 UNQ207/PRO233"	"Homo sapiens (Human)"	"300"
"Q8WVV4"	"POF1B_HUMAN"	"reviewed"	"Protein POF1B (Premature ovarian failure protein 1B)"	"POF1B"	"Homo sapiens (Human)"	"589"
"Q8WWY3"	"PRP31_HUMAN"	"reviewed"	"U4/U6 small nuclear ribonucleoprotein Prp31 (Pre-mRNA-processing factor 31) (Serologically defined breast cancer antigen NY-BR-99) (U4/U6 snRNP 61 kDa protein) (Protein 61K) (hPrp31)"	"PRPF31 PRP31"	"Homo sapiens (Human)"	"499"
"Q8WVV9"	"HNRLL_HUMAN"	"reviewed"	"Heterogeneous nuclear ribonucleoprotein L-like (hnRNPLL) (Stromal RNA-regulating factor)"	"HNRNPLL HNRPLL SRRF BLOCK24"	"Homo sapiens (Human)"	"542"
"Q8NCW5"	"NNRE_HUMAN"	"reviewed"	"NAD(P)H-hydrate epimerase (EC 5.1.99.6) (Apolipoprotein A-I-binding protein) (AI-BP) (NAD(P)HX epimerase) (YjeF N-terminal domain-containing protein 1) (YjeF_N1)"	"NAXE AIBP APOA1BP YJEFN1"	"Homo sapiens (Human)"	"288"
"Q8NEY8"	"PPHLN_HUMAN"	"reviewed"	"Periphilin-1 (CDC7 expression repressor) (CR) (Gastric cancer antigen Ga50)"	"PPHLN1 HSPC206 HSPC232"	"Homo sapiens (Human)"	"458"
"Q8TEM1"	"PO210_HUMAN"	"reviewed"	"Nuclear pore membrane glycoprotein 210 (Nuclear pore protein gp210) (Nuclear envelope pore membrane protein POM 210) (POM210) (Nucleoporin Nup210) (Pore membrane protein of 210 kDa)"	"NUP210 KIAA0906 PSEC0245"	"Homo sapiens (Human)"	"1887"
"P51513"	"NOVA1_HUMAN"	"reviewed"	"RNA-binding protein Nova-1 (Neuro-oncological ventral antigen 1) (Onconeural ventral antigen 1) (Paraneoplastic Ri antigen) (Ventral neuron-specific protein 1)"	"NOVA1"	"Homo sapiens (Human)"	"507"
"Q8WW12"	"PCNP_HUMAN"	"reviewed"	"PEST proteolytic signal-containing nuclear protein (PCNP) (PEST-containing nuclear protein)"	"PCNP"	"Homo sapiens (Human)"	"178"
"Q8WXI7"	"MUC16_HUMAN"	"reviewed"	"Mucin-16 (MUC-16) (Ovarian cancer-related tumor marker CA125) (CA-125) (Ovarian carcinoma antigen CA125)"	"MUC16 CA125"	"Homo sapiens (Human)"	"14507"
"Q8NC51"	"PAIRB_HUMAN"	"reviewed"	"Plasminogen activator inhibitor 1 RNA-binding protein (PAI1 RNA-binding protein 1) (PAI-RBP1) (SERPINE1 mRNA-binding protein 1)"	"SERBP1 PAIRBP1 CGI-55"	"Homo sapiens (Human)"	"408"
"Q8WXF1"	"PSPC1_HUMAN"	"reviewed"	"Paraspeckle component 1 (Paraspeckle protein 1)"	"PSPC1 PSP1"	"Homo sapiens (Human)"	"523"
"Q8TCS8"	"PNPT1_HUMAN"	"reviewed"	"Polyribonucleotide nucleotidyltransferase 1, mitochondrial (EC 2.7.7.8) (3'-5' RNA exonuclease OLD35) (PNPase old-35) (Polynucleotide phosphorylase 1) (PNPase 1) (Polynucleotide phosphorylase-like protein)"	"PNPT1 PNPASE"	"Homo sapiens (Human)"	"783"
"Q99733"	"NP1L4_HUMAN"	"reviewed"	"Nucleosome assembly protein 1-like 4 (Nucleosome assembly protein 2) (NAP-2)"	"NAP1L4 NAP2"	"Homo sapiens (Human)"	"375"
"Q8TAT6"	"NPL4_HUMAN"	"reviewed"	"Nuclear protein localization protein 4 homolog (Protein NPL4)"	"NPLOC4 KIAA1499 NPL4"	"Homo sapiens (Human)"	"608"
"Q8ND04"	"SMG8_HUMAN"	"reviewed"	"Protein SMG8 (Amplified in breast cancer gene 2 protein) (Protein smg-8 homolog)"	"SMG8 ABC2 C17orf71"	"Homo sapiens (Human)"	"991"
"Q8NBX0"	"SCPDL_HUMAN"	"reviewed"	"Saccharopine dehydrogenase-like oxidoreductase (EC 1.-.-.-)"	"SCCPDH CGI-49"	"Homo sapiens (Human)"	"429"
"P20719"	"HXA5_HUMAN"	"reviewed"	"Homeobox protein Hox-A5 (Homeobox protein Hox-1C)"	"HOXA5 HOX1C"	"Homo sapiens (Human)"	"270"
"Q8WUM4"	"PDC6I_HUMAN"	"reviewed"	"Programmed cell death 6-interacting protein (PDCD6-interacting protein) (ALG-2-interacting protein 1) (ALG-2-interacting protein X) (Hp95)"	"PDCD6IP AIP1 ALIX KIAA1375"	"Homo sapiens (Human)"	"868"
"Q8NC60"	"NOA1_HUMAN"	"reviewed"	"Nitric oxide-associated protein 1"	"NOA1 C4orf14"	"Homo sapiens (Human)"	"698"
"Q8NE71"	"ABCF1_HUMAN"	"reviewed"	"ATP-binding cassette sub-family F member 1 (ATP-binding cassette 50) (TNF-alpha-stimulated ABC protein)"	"ABCF1 ABC50"	"Homo sapiens (Human)"	"845"
"Q8TCT9"	"HM13_HUMAN"	"reviewed"	"Minor histocompatibility antigen H13 (EC 3.4.23.-) (Intramembrane protease 1) (IMP-1) (IMPAS-1) (hIMP1) (Presenilin-like protein 3) (Signal peptide peptidase)"	"HM13 H13 IMP1 PSL3 SPP MSTP086"	"Homo sapiens (Human)"	"377"
"P03956"	"MMP1_HUMAN"	"reviewed"	"Interstitial collagenase (EC 3.4.24.7) (Fibroblast collagenase) (Matrix metalloproteinase-1) (MMP-1) [Cleaved into: 22 kDa interstitial collagenase; 27 kDa interstitial collagenase]"	"MMP1 CLG"	"Homo sapiens (Human)"	"469"
"Q8NCA5"	"FA98A_HUMAN"	"reviewed"	"Protein FAM98A"	"FAM98A"	"Homo sapiens (Human)"	"518"
"Q8NFH3"	"NUP43_HUMAN"	"reviewed"	"Nucleoporin Nup43 (Nup107-160 subcomplex subunit Nup43) (p42)"	"NUP43"	"Homo sapiens (Human)"	"380"
"Q8TB37"	"NUBPL_HUMAN"	"reviewed"	"Iron-sulfur protein NUBPL (IND1 homolog) (Nucleotide-binding protein-like) (huInd1)"	"NUBPL C14orf127"	"Homo sapiens (Human)"	"319"
"Q8WUA2"	"PPIL4_HUMAN"	"reviewed"	"Peptidyl-prolyl cis-trans isomerase-like 4 (PPIase) (EC 5.2.1.8) (Cyclophilin-like protein PPIL4) (Rotamase PPIL4)"	"PPIL4"	"Homo sapiens (Human)"	"492"
"Q8ND56"	"LS14A_HUMAN"	"reviewed"	"Protein LSM14 homolog A (Protein FAM61A) (Protein SCD6 homolog) (Putative alpha-synuclein-binding protein) (AlphaSNBP) (RNA-associated protein 55A) (hRAP55) (hRAP55A)"	"LSM14A C19orf13 FAM61A RAP55 RAP55A"	"Homo sapiens (Human)"	"463"
"Q8TEX9"	"IPO4_HUMAN"	"reviewed"	"Importin-4 (Imp4) (Importin-4b) (Imp4b) (Ran-binding protein 4) (RanBP4)"	"IPO4 IMP4B RANBP4"	"Homo sapiens (Human)"	"1081"
"P09016"	"HXD4_HUMAN"	"reviewed"	"Homeobox protein Hox-D4 (Homeobox protein HHO.C13) (Homeobox protein Hox-4B) (Homeobox protein Hox-5.1)"	"HOXD4 HOX4B"	"Homo sapiens (Human)"	"255"
"Q8TEA8"	"DTD1_HUMAN"	"reviewed"	"D-aminoacyl-tRNA deacylase 1 (DTD) (EC 3.1.1.96) (DNA-unwinding element-binding protein B) (DUE-B) (Gly-tRNA(Ala) deacylase) (Histidyl-tRNA synthase-related)"	"DTD1 C20orf88 DUEB HARS2"	"Homo sapiens (Human)"	"209"
"Q9NY12"	"GAR1_HUMAN"	"reviewed"	"H/ACA ribonucleoprotein complex subunit 1 (Nucleolar protein family A member 1) (snoRNP protein GAR1)"	"GAR1 NOLA1"	"Homo sapiens (Human)"	"217"
"Q8NFF5"	"FAD1_HUMAN"	"reviewed"	"FAD synthase (EC 2.7.7.2) (FAD pyrophosphorylase) (FMN adenylyltransferase) (Flavin adenine dinucleotide synthase) [Includes: Molybdenum cofactor biosynthesis protein-like region; FAD synthase region]"	"FLAD1 PP591"	"Homo sapiens (Human)"	"587"
"Q8NI60"	"COQ8A_HUMAN"	"reviewed"	"Atypical kinase COQ8A, mitochondrial (EC 2.7.-.-) (Chaperone activity of bc1 complex-like) (Chaperone-ABC1-like) (Coenzyme Q protein 8A) (aarF domain-containing protein kinase 3)"	"COQ8A ADCK3 CABC1 PP265"	"Homo sapiens (Human)"	"647"
"Q8TEQ6"	"GEMI5_HUMAN"	"reviewed"	"Gem-associated protein 5 (Gemin5)"	"GEMIN5"	"Homo sapiens (Human)"	"1508"
"Q92841"	"DDX17_HUMAN"	"reviewed"	"Probable ATP-dependent RNA helicase DDX17 (EC 3.6.4.13) (DEAD box protein 17) (DEAD box protein p72) (DEAD box protein p82) (RNA-dependent helicase p72)"	"DDX17"	"Homo sapiens (Human)"	"729"
"Q93045"	"STMN2_HUMAN"	"reviewed"	"Stathmin-2 (Superior cervical ganglion-10 protein) (Protein SCG10)"	"STMN2 SCG10 SCGN10"	"Homo sapiens (Human)"	"179"
"Q92890"	"UFD1_HUMAN"	"reviewed"	"Ubiquitin recognition factor in ER-associated degradation protein 1 (Ubiquitin fusion degradation protein 1) (UB fusion protein 1)"	"UFD1 UFD1L"	"Homo sapiens (Human)"	"307"
"Q92575"	"UBXN4_HUMAN"	"reviewed"	"UBX domain-containing protein 4 (Erasin) (UBX domain-containing protein 2)"	"UBXN4 KIAA0242 UBXD2 UBXDC1"	"Homo sapiens (Human)"	"508"
"Q92504"	"S39A7_HUMAN"	"reviewed"	"Zinc transporter SLC39A7 (Histidine-rich membrane protein Ke4) (Really interesting new gene 5 protein) (Solute carrier family 39 member 7) (Zrt-, Irt-like protein 7) (ZIP7)"	"SLC39A7 HKE4 RING5"	"Homo sapiens (Human)"	"469"
"Q8WZ42"	"TITIN_HUMAN"	"reviewed"	"Titin (EC 2.7.11.1) (Connectin) (Rhabdomyosarcoma antigen MU-RMS-40.14)"	"TTN"	"Homo sapiens (Human)"	"34350"
"Q92973"	"TNPO1_HUMAN"	"reviewed"	"Transportin-1 (Importin beta-2) (Karyopherin beta-2) (M9 region interaction protein) (MIP)"	"TNPO1 KPNB2 MIP1 TRN"	"Homo sapiens (Human)"	"898"
"Q93009"	"UBP7_HUMAN"	"reviewed"	"Ubiquitin carboxyl-terminal hydrolase 7 (EC 3.4.19.12) (Deubiquitinating enzyme 7) (Herpesvirus-associated ubiquitin-specific protease) (Ubiquitin thioesterase 7) (Ubiquitin-specific-processing protease 7)"	"USP7 HAUSP"	"Homo sapiens (Human)"	"1102"
"Q92665"	"RT31_HUMAN"	"reviewed"	"28S ribosomal protein S31, mitochondrial (MRP-S31) (S31mt) (Imogen 38) (Mitochondrial small ribosomal subunit protein mS31)"	"MRPS31 IMOGN38"	"Homo sapiens (Human)"	"395"
"Q92599"	"SEPT8_HUMAN"	"reviewed"	"Septin-8"	"SEPTIN8 KIAA0202 SEPT8"	"Homo sapiens (Human)"	"483"
"Q92959"	"SO2A1_HUMAN"	"reviewed"	"Solute carrier organic anion transporter family member 2A1 (Prostaglandin transporter) (PGT) (Solute carrier family 21 member 2)"	"SLCO2A1 OATP2A1 SLC21A2"	"Homo sapiens (Human)"	"643"
"Q93008"	"USP9X_HUMAN"	"reviewed"	"Probable ubiquitin carboxyl-terminal hydrolase FAF-X (EC 3.4.19.12) (Deubiquitinating enzyme FAF-X) (Fat facets in mammals) (hFAM) (Fat facets protein-related, X-linked) (Ubiquitin thioesterase FAF-X) (Ubiquitin-specific protease 9, X chromosome) (Ubiquitin-specific-processing protease FAF-X)"	"USP9X DFFRX FAM USP9"	"Homo sapiens (Human)"	"2570"
"Q92688"	"AN32B_HUMAN"	"reviewed"	"Acidic leucine-rich nuclear phosphoprotein 32 family member B (Acidic protein rich in leucines) (Putative HLA-DR-associated protein I-2) (PHAPI2) (Silver-stainable protein SSP29)"	"ANP32B APRIL PHAPI2"	"Homo sapiens (Human)"	"251"
"Q92506"	"DHB8_HUMAN"	"reviewed"	"Estradiol 17-beta-dehydrogenase 8 (EC 1.1.1.62) (17-beta-hydroxysteroid dehydrogenase 8) (17-beta-HSD 8) (3-ketoacyl-[acyl-carrier-protein] reductase alpha subunit) (KAR alpha subunit) (3-oxoacyl-[acyl-carrier-protein] reductase) (EC 1.1.1.-) (Protein Ke6) (Ke-6) (Really interesting new gene 2 protein) (Short chain dehydrogenase/reductase family 30C member 1) (Testosterone 17-beta-dehydrogenase 8) (EC 1.1.1.239)"	"HSD17B8 FABGL HKE6 RING2 SDR30C1"	"Homo sapiens (Human)"	"261"
"Q96A33"	"CCD47_HUMAN"	"reviewed"	"Coiled-coil domain-containing protein 47 (Calumin)"	"CCDC47 GK001 MSTP041 PSEC0077"	"Homo sapiens (Human)"	"483"
"Q92879"	"CELF1_HUMAN"	"reviewed"	"CUGBP Elav-like family member 1 (CELF-1) (50 kDa nuclear polyadenylated RNA-binding protein) (Bruno-like protein 2) (CUG triplet repeat RNA-binding protein 1) (CUG-BP1) (CUG-BP- and ETR-3-like factor 1) (Deadenylation factor CUG-BP) (Embryo deadenylation element-binding protein homolog) (EDEN-BP homolog) (RNA-binding protein BRUNOL-2)"	"CELF1 BRUNOL2 CUGBP CUGBP1 NAB50"	"Homo sapiens (Human)"	"486"
"Q969S9"	"RRF2M_HUMAN"	"reviewed"	"Ribosome-releasing factor 2, mitochondrial (RRF2mt) (Elongation factor G 2, mitochondrial) (EF-G2mt) (mEF-G 2) (Elongation factor G2) (hEFG2)"	"GFM2 EFG2 MSTP027"	"Homo sapiens (Human)"	"779"
"Q92974"	"ARHG2_HUMAN"	"reviewed"	"Rho guanine nucleotide exchange factor 2 (Guanine nucleotide exchange factor H1) (GEF-H1) (Microtubule-regulated Rho-GEF) (Proliferating cell nucleolar antigen p40)"	"ARHGEF2 KIAA0651 LFP40"	"Homo sapiens (Human)"	"986"
"Q93062"	"RBPMS_HUMAN"	"reviewed"	"RNA-binding protein with multiple splicing (RBP-MS) (Heart and RRM expressed sequence) (Hermes)"	"RBPMS HERMES"	"Homo sapiens (Human)"	"196"
"Q96A35"	"RM24_HUMAN"	"reviewed"	"39S ribosomal protein L24, mitochondrial (L24mt) (MRP-L24) (Mitochondrial large ribosomal subunit protein uL24m)"	"MRPL24"	"Homo sapiens (Human)"	"216"
"Q96AG4"	"LRC59_HUMAN"	"reviewed"	"Leucine-rich repeat-containing protein 59 (Ribosome-binding protein p34) (p34) [Cleaved into: Leucine-rich repeat-containing protein 59, N-terminally processed]"	"LRRC59 PRO1855"	"Homo sapiens (Human)"	"307"
"Q92804"	"RBP56_HUMAN"	"reviewed"	"TATA-binding protein-associated factor 2N (68 kDa TATA-binding protein-associated factor) (TAF(II)68) (TAFII68) (RNA-binding protein 56)"	"TAF15 RBP56 TAF2N"	"Homo sapiens (Human)"	"592"
"Q96AB3"	"ISOC2_HUMAN"	"reviewed"	"Isochorismatase domain-containing protein 2"	"ISOC2"	"Homo sapiens (Human)"	"205"
"Q96AQ6"	"PBIP1_HUMAN"	"reviewed"	"Pre-B-cell leukemia transcription factor-interacting protein 1 (Hematopoietic PBX-interacting protein)"	"PBXIP1 HPIP"	"Homo sapiens (Human)"	"731"
"Q92620"	"PRP16_HUMAN"	"reviewed"	"Pre-mRNA-splicing factor ATP-dependent RNA helicase PRP16 (EC 3.6.4.13) (ATP-dependent RNA helicase DHX38) (DEAH box protein 38)"	"DHX38 DDX38 KIAA0224 PRP16"	"Homo sapiens (Human)"	"1227"
"Q92979"	"NEP1_HUMAN"	"reviewed"	"Ribosomal RNA small subunit methyltransferase NEP1 (EC 2.1.1.-) (18S rRNA (pseudouridine(1248)-N1)-methyltransferase) (18S rRNA Psi1248 methyltransferase) (Nucleolar protein EMG1 homolog) (Protein C2f) (Ribosome biogenesis protein NEP1)"	"EMG1 C2F"	"Homo sapiens (Human)"	"244"
"Q92615"	"LAR4B_HUMAN"	"reviewed"	"La-related protein 4B (La ribonucleoprotein domain family member 4B) (La ribonucleoprotein domain family member 5) (La-related protein 5)"	"LARP4B KIAA0217 LARP5"	"Homo sapiens (Human)"	"738"
"Q96A72"	"MGN2_HUMAN"	"reviewed"	"Protein mago nashi homolog 2"	"MAGOHB MAGOH2"	"Homo sapiens (Human)"	"148"
"Q92882"	"OSTF1_HUMAN"	"reviewed"	"Osteoclast-stimulating factor 1"	"OSTF1"	"Homo sapiens (Human)"	"214"
"Q96AK3"	"ABC3D_HUMAN"	"reviewed"	"DNA dC->dU-editing enzyme APOBEC-3D (A3D) (A3DE) (EC 3.5.4.38)"	"APOBEC3D APOBEC3DE"	"Homo sapiens (Human)"	"386"
"Q96A32"	"MLRS_HUMAN"	"reviewed"	"Myosin regulatory light chain 2, skeletal muscle isoform (Fast skeletal myosin light chain 2) (MLC2B)"	"MYLPF"	"Homo sapiens (Human)"	"169"
"Q92917"	"GPKOW_HUMAN"	"reviewed"	"G-patch domain and KOW motifs-containing protein (G-patch domain-containing protein 5) (Protein MOS2 homolog) (Protein T54)"	"GPKOW GPATC5 GPATCH5 T54"	"Homo sapiens (Human)"	"476"
"Q969Y2"	"GTPB3_HUMAN"	"reviewed"	"tRNA modification GTPase GTPBP3, mitochondrial (GTP-binding protein 3) (Mitochondrial GTP-binding protein 1)"	"GTPBP3 MTGP1"	"Homo sapiens (Human)"	"492"
"Q92900"	"RENT1_HUMAN"	"reviewed"	"Regulator of nonsense transcripts 1 (EC 3.6.4.-) (ATP-dependent helicase RENT1) (Nonsense mRNA reducing factor 1) (NORF1) (Up-frameshift suppressor 1 homolog) (hUpf1)"	"UPF1 KIAA0221 RENT1"	"Homo sapiens (Human)"	"1129"
"Q92797"	"SYMPK_HUMAN"	"reviewed"	"Symplekin"	"SYMPK SPK"	"Homo sapiens (Human)"	"1274"
"Q92922"	"SMRC1_HUMAN"	"reviewed"	"SWI/SNF complex subunit SMARCC1 (BRG1-associated factor 155) (BAF155) (SWI/SNF complex 155 kDa subunit) (SWI/SNF-related matrix-associated actin-dependent regulator of chromatin subfamily C member 1)"	"SMARCC1 BAF155"	"Homo sapiens (Human)"	"1105"
"Q92930"	"RAB8B_HUMAN"	"reviewed"	"Ras-related protein Rab-8B"	"RAB8B"	"Homo sapiens (Human)"	"207"
"Q92552"	"RT27_HUMAN"	"reviewed"	"28S ribosomal protein S27, mitochondrial (MRP-S27) (S27mt) (Mitochondrial ribosomal protein S27) (Mitochondrial small ribosomal subunit protein mS27)"	"MRPS27 KIAA0264"	"Homo sapiens (Human)"	"414"
"Q96A26"	"F162A_HUMAN"	"reviewed"	"Protein FAM162A (E2-induced gene 5 protein) (Growth and transformation-dependent protein) (HGTD-P)"	"FAM162A C3orf28 E2IG5 DC16 FWP001"	"Homo sapiens (Human)"	"154"
"Q92945"	"FUBP2_HUMAN"	"reviewed"	"Far upstream element-binding protein 2 (FUSE-binding protein 2) (KH type-splicing regulatory protein) (KSRP) (p75)"	"KHSRP FUBP2"	"Homo sapiens (Human)"	"711"
"Q93052"	"LPP_HUMAN"	"reviewed"	"Lipoma-preferred partner (LIM domain-containing preferred translocation partner in lipoma)"	"LPP"	"Homo sapiens (Human)"	"612"
"Q92817"	"EVPL_HUMAN"	"reviewed"	"Envoplakin (210 kDa cornified envelope precursor protein) (210 kDa paraneoplastic pemphigus antigen) (p210)"	"EVPL"	"Homo sapiens (Human)"	"2033"
"Q92947"	"GCDH_HUMAN"	"reviewed"	"Glutaryl-CoA dehydrogenase, mitochondrial (GCD) (EC 1.3.8.6)"	"GCDH"	"Homo sapiens (Human)"	"438"
"Q969Z0"	"FAKD4_HUMAN"	"reviewed"	"FAST kinase domain-containing protein 4 (Cell cycle progression restoration protein 2) (Cell cycle progression protein 2) (Protein TBRG4) (Transforming growth factor beta regulator 4)"	"TBRG4 CPR2 FASTKD4 KIAA0948"	"Homo sapiens (Human)"	"631"
"Q93099"	"HGD_HUMAN"	"reviewed"	"Homogentisate 1,2-dioxygenase (EC 1.13.11.5) (Homogentisate oxygenase) (Homogentisic acid oxidase) (Homogentisicase)"	"HGD HGO"	"Homo sapiens (Human)"	"445"
"Q92598"	"HS105_HUMAN"	"reviewed"	"Heat shock protein 105 kDa (Antigen NY-CO-25) (Heat shock 110 kDa protein)"	"HSPH1 HSP105 HSP110 KIAA0201"	"Homo sapiens (Human)"	"858"
"Q92499"	"DDX1_HUMAN"	"reviewed"	"ATP-dependent RNA helicase DDX1 (EC 3.6.4.13) (DEAD box protein 1) (DEAD box protein retinoblastoma) (DBP-RB)"	"DDX1"	"Homo sapiens (Human)"	"740"
"Q969X5"	"ERGI1_HUMAN"	"reviewed"	"Endoplasmic reticulum-Golgi intermediate compartment protein 1 (ER-Golgi intermediate compartment 32 kDa protein) (ERGIC-32)"	"ERGIC1 ERGIC32 KIAA1181 HT034"	"Homo sapiens (Human)"	"290"
"Q92616"	"GCN1_HUMAN"	"reviewed"	"eIF-2-alpha kinase activator GCN1 (GCN1 eIF-2-alpha kinase activator homolog) (GCN1-like protein 1) (General control of amino-acid synthesis 1-like protein 1) (Translational activator GCN1) (HsGCN1)"	"GCN1 GCN1L1 KIAA0219"	"Homo sapiens (Human)"	"2671"
"Q96AE4"	"FUBP1_HUMAN"	"reviewed"	"Far upstream element-binding protein 1 (FBP) (FUSE-binding protein 1) (DNA helicase V) (hDH V)"	"FUBP1"	"Homo sapiens (Human)"	"644"
"Q96CM8"	"ACSF2_HUMAN"	"reviewed"	"Medium-chain acyl-CoA ligase ACSF2, mitochondrial (EC 6.2.1.2)"	"ACSF2 UNQ493/PRO1009"	"Homo sapiens (Human)"	"615"
"Q96I99"	"SUCB2_HUMAN"	"reviewed"	"Succinate--CoA ligase [GDP-forming] subunit beta, mitochondrial (EC 6.2.1.4) (GTP-specific succinyl-CoA synthetase subunit beta) (G-SCS) (GTPSCS) (Succinyl-CoA synthetase beta-G chain) (SCS-betaG)"	"SUCLG2"	"Homo sapiens (Human)"	"432"
"Q96PK6"	"RBM14_HUMAN"	"reviewed"	"RNA-binding protein 14 (Paraspeckle protein 2) (PSP2) (RNA-binding motif protein 14) (RRM-containing coactivator activator/modulator) (Synaptotagmin-interacting protein) (SYT-interacting protein)"	"RBM14 SIP"	"Homo sapiens (Human)"	"669"
"Q96I51"	"RCC1L_HUMAN"	"reviewed"	"RCC1-like G exchanging factor-like protein (RCC1-like) (Williams-Beuren syndrome chromosomal region 16 protein)"	"RCC1L WBSCR16"	"Homo sapiens (Human)"	"464"
"Q96E11"	"RRFM_HUMAN"	"reviewed"	"Ribosome-recycling factor, mitochondrial (RRF) (Ribosome-releasing factor, mitochondrial)"	"MRRF"	"Homo sapiens (Human)"	"262"
"Q96I59"	"SYNM_HUMAN"	"reviewed"	"Probable asparagine--tRNA ligase, mitochondrial (EC 6.1.1.22) (Asparaginyl-tRNA synthetase) (AsnRS)"	"NARS2"	"Homo sapiens (Human)"	"477"
"Q96KR1"	"ZFR_HUMAN"	"reviewed"	"Zinc finger RNA-binding protein (hZFR) (M-phase phosphoprotein homolog)"	"ZFR"	"Homo sapiens (Human)"	"1074"
"Q96GW9"	"SYMM_HUMAN"	"reviewed"	"Methionine--tRNA ligase, mitochondrial (EC 6.1.1.10) (Methionyl-tRNA synthetase 2) (Mitochondrial methionyl-tRNA synthetase) (MtMetRS)"	"MARS2"	"Homo sapiens (Human)"	"593"
"Q96K17"	"BT3L4_HUMAN"	"reviewed"	"Transcription factor BTF3 homolog 4 (Basic transcription factor 3-like 4)"	"BTF3L4"	"Homo sapiens (Human)"	"158"
"Q96GK7"	"FAH2A_HUMAN"	"reviewed"	"Fumarylacetoacetate hydrolase domain-containing protein 2A (EC 3.-.-.-)"	"FAHD2A CGI-105"	"Homo sapiens (Human)"	"314"
"Q96EY1"	"DNJA3_HUMAN"	"reviewed"	"DnaJ homolog subfamily A member 3, mitochondrial (DnaJ protein Tid-1) (hTid-1) (Hepatocellular carcinoma-associated antigen 57) (Tumorous imaginal discs protein Tid56 homolog)"	"DNAJA3 HCA57 TID1"	"Homo sapiens (Human)"	"480"
"Q96P63"	"SPB12_HUMAN"	"reviewed"	"Serpin B12"	"SERPINB12"	"Homo sapiens (Human)"	"405"
"Q96FQ6"	"S10AG_HUMAN"	"reviewed"	"Protein S100-A16 (Aging-associated gene 13 protein) (Protein S100-F) (S100 calcium-binding protein A16)"	"S100A16 S100F AAG13"	"Homo sapiens (Human)"	"103"
"Q96DI7"	"SNR40_HUMAN"	"reviewed"	"U5 small nuclear ribonucleoprotein 40 kDa protein (U5 snRNP 40 kDa protein) (U5-40K) (38 kDa-splicing factor) (Prp8-binding protein) (hPRP8BP) (U5 snRNP-specific 40 kDa protein) (WD repeat-containing protein 57)"	"SNRNP40 PRP8BP SFP38 WDR57"	"Homo sapiens (Human)"	"357"
"Q96H79"	"ZCCHL_HUMAN"	"reviewed"	"Zinc finger CCCH-type antiviral protein 1-like"	"ZC3HAV1L C7orf39"	"Homo sapiens (Human)"	"300"
"Q96MU7"	"YTDC1_HUMAN"	"reviewed"	"YTH domain-containing protein 1 (Splicing factor YT521) (YT521-B)"	"YTHDC1 KIAA1966 YT521"	"Homo sapiens (Human)"	"727"
"Q96GG9"	"DCNL1_HUMAN"	"reviewed"	"DCN1-like protein 1 (DCUN1 domain-containing protein 1) (Defective in cullin neddylation protein 1-like protein 1) (Squamous cell carcinoma-related oncogene)"	"DCUN1D1 DCN1 DCUN1L1 RP42 SCCRO"	"Homo sapiens (Human)"	"259"
"Q96EN8"	"MOCOS_HUMAN"	"reviewed"	"Molybdenum cofactor sulfurase (MCS) (MOS) (MoCo sulfurase) (hMCS) (EC 2.8.1.9) (Molybdenum cofactor sulfurtransferase)"	"MOCOS"	"Homo sapiens (Human)"	"888"
"Q96GC5"	"RM48_HUMAN"	"reviewed"	"39S ribosomal protein L48, mitochondrial (L48mt) (MRP-L48) (Mitochondrial large ribosomal subunit protein mL48)"	"MRPL48 CGI-118 HSPC290"	"Homo sapiens (Human)"	"212"
"Q96PV4"	"PNMA5_HUMAN"	"reviewed"	"Paraneoplastic antigen-like protein 5 (Tumor antigen BJ-HCC-25)"	"PNMA5 KIAA1934"	"Homo sapiens (Human)"	"448"
"Q96HR9"	"REEP6_HUMAN"	"reviewed"	"Receptor expression-enhancing protein 6 (Polyposis locus protein 1-like 1)"	"REEP6 C19orf32 DP1L1"	"Homo sapiens (Human)"	"211"
"Q96P70"	"IPO9_HUMAN"	"reviewed"	"Importin-9 (Imp9) (Ran-binding protein 9) (RanBP9)"	"IPO9 IMP9 KIAA1192 RANBP9 HSPC273"	"Homo sapiens (Human)"	"1041"
"Q96C36"	"P5CR2_HUMAN"	"reviewed"	"Pyrroline-5-carboxylate reductase 2 (P5C reductase 2) (P5CR 2) (EC 1.5.1.2)"	"PYCR2"	"Homo sapiens (Human)"	"320"
"Q96G03"	"PGM2_HUMAN"	"reviewed"	"Phosphoglucomutase-2 (PGM 2) (EC 5.4.2.2) (Glucose phosphomutase 2) (Phosphodeoxyribomutase) (Phosphopentomutase) (EC 5.4.2.7)"	"PGM2 MSTP006"	"Homo sapiens (Human)"	"612"
"Q96NW7"	"LRRC7_HUMAN"	"reviewed"	"Leucine-rich repeat-containing protein 7 (Densin-180) (Densin) (Protein LAP1)"	"LRRC7 KIAA1365 LAP1"	"Homo sapiens (Human)"	"1537"
"Q96DH6"	"MSI2H_HUMAN"	"reviewed"	"RNA-binding protein Musashi homolog 2 (Musashi-2)"	"MSI2"	"Homo sapiens (Human)"	"328"
"Q96FW1"	"OTUB1_HUMAN"	"reviewed"	"Ubiquitin thioesterase OTUB1 (EC 3.4.19.12) (Deubiquitinating enzyme OTUB1) (OTU domain-containing ubiquitin aldehyde-binding protein 1) (Otubain-1) (hOTU1) (Ubiquitin-specific-processing protease OTUB1)"	"OTUB1 OTB1 OTU1 HSPC263"	"Homo sapiens (Human)"	"271"
"Q96HP4"	"OXND1_HUMAN"	"reviewed"	"Oxidoreductase NAD-binding domain-containing protein 1 (EC 1.-.-.-)"	"OXNAD1"	"Homo sapiens (Human)"	"312"
"Q96PU8"	"QKI_HUMAN"	"reviewed"	"Protein quaking (Hqk) (HqkI)"	"QKI HKQ"	"Homo sapiens (Human)"	"341"
"Q96E39"	"RMXL1_HUMAN"	"reviewed"	"RNA binding motif protein, X-linked-like-1 (Heterogeneous nuclear ribonucleoprotein G-like 1)"	"RBMXL1"	"Homo sapiens (Human)"	"390"
"Q96CB9"	"NSUN4_HUMAN"	"reviewed"	"5-methylcytosine rRNA methyltransferase NSUN4 (EC 2.1.1.-) (NOL1/NOP2/Sun domain family member 4)"	"NSUN4"	"Homo sapiens (Human)"	"384"
"Q96EY7"	"PTCD3_HUMAN"	"reviewed"	"Pentatricopeptide repeat domain-containing protein 3, mitochondrial (28S ribosomal protein S39, mitochondrial) (MRP-S39) (Mitochondrial small ribosomal subunit protein mS39) (Transformation-related gene 15 protein) (TRG-15)"	"PTCD3 MRPS39 TRG15"	"Homo sapiens (Human)"	"689"
"Q96PZ0"	"PUS7_HUMAN"	"reviewed"	"Pseudouridylate synthase 7 homolog (EC 5.4.99.-)"	"PUS7 KIAA1897"	"Homo sapiens (Human)"	"661"
"Q96HC4"	"PDLI5_HUMAN"	"reviewed"	"PDZ and LIM domain protein 5 (Enigma homolog) (Enigma-like PDZ and LIM domains protein)"	"PDLIM5 ENH L9"	"Homo sapiens (Human)"	"596"
"Q96E29"	"MTEF3_HUMAN"	"reviewed"	"Transcription termination factor 3, mitochondrial (Mitochondrial transcription termination factor 3) (mTERF3) (mTERF domain-containing protein 1, mitochondrial)"	"MTERF3 MTERFD1 CGI-12"	"Homo sapiens (Human)"	"417"
"Q96ER9"	"MITOK_HUMAN"	"reviewed"	"Mitochondrial potassium channel (MITOK) (Coiled-coil domain-containing protein 51)"	"CCDC51 MITOK"	"Homo sapiens (Human)"	"411"
"Q96LU7"	"MRFL_HUMAN"	"reviewed"	"Myelin regulatory factor-like protein"	"MYRFL C12orf15 C12orf28"	"Homo sapiens (Human)"	"910"
"Q96CU9"	"FXRD1_HUMAN"	"reviewed"	"FAD-dependent oxidoreductase domain-containing protein 1 (EC 1.-.-.-)"	"FOXRED1 FP634"	"Homo sapiens (Human)"	"486"
"Q96CN7"	"ISOC1_HUMAN"	"reviewed"	"Isochorismatase domain-containing protein 1"	"ISOC1 CGI-111"	"Homo sapiens (Human)"	"298"
"Q96HY6"	"DDRGK_HUMAN"	"reviewed"	"DDRGK domain-containing protein 1 (Dashurin) (UFM1-binding and PCI domain-containing protein 1)"	"DDRGK1 C20orf116 UFBP1"	"Homo sapiens (Human)"	"314"
"Q96DC8"	"ECHD3_HUMAN"	"reviewed"	"Enoyl-CoA hydratase domain-containing protein 3, mitochondrial"	"ECHDC3 PP1494 PP8332"	"Homo sapiens (Human)"	"303"
"Q96IR7"	"HPDL_HUMAN"	"reviewed"	"4-hydroxyphenylpyruvate dioxygenase-like protein (EC 1.13.-.-) (Glyoxalase domain-containing protein 1)"	"HPDL GLOXD1"	"Homo sapiens (Human)"	"371"
"Q96EY8"	"MMAB_HUMAN"	"reviewed"	"Corrinoid adenosyltransferase (EC 2.5.1.17) (Cob(II)alamin adenosyltransferase) (Cob(II)yrinic acid a,c-diamide adenosyltransferase) (Cobinamide/cobalamin adenosyltransferase) (Methylmalonic aciduria type B protein)"	"MMAB"	"Homo sapiens (Human)"	"250"
"Q96PE3"	"INP4A_HUMAN"	"reviewed"	"Inositol polyphosphate-4-phosphatase type I A (Inositol polyphosphate 4-phosphatase type I) (Type I inositol 3,4-bisphosphate 4-phosphatase) (EC 3.1.3.66)"	"INPP4A"	"Homo sapiens (Human)"	"977"
