"Entry"	"Entry.name"	"Status"	"Protein.names"	"Gene.names"	"Organism"	"Length"
"P22061"	"PIMT_HUMAN"	"reviewed"	"Protein-L-isoaspartate(D-aspartate) O-methyltransferase (PIMT) (EC 2.1.1.77) (L-isoaspartyl protein carboxyl methyltransferase) (Protein L-isoaspartyl/D-aspartyl methyltransferase) (Protein-beta-aspartate methyltransferase)"	"PCMT1"	"Homo sapiens (Human)"	"227"
"P17980"	"PRS6A_HUMAN"	"reviewed"	"26S proteasome regulatory subunit 6A (26S proteasome AAA-ATPase subunit RPT5) (Proteasome 26S subunit ATPase 3) (Proteasome subunit P50) (Tat-binding protein 1) (TBP-1)"	"PSMC3 TBP1"	"Homo sapiens (Human)"	"439"
"P20472"	"PRVA_HUMAN"	"reviewed"	"Parvalbumin alpha"	"PVALB"	"Homo sapiens (Human)"	"110"
"P17987"	"TCPA_HUMAN"	"reviewed"	"T-complex protein 1 subunit alpha (TCP-1-alpha) (CCT-alpha)"	"TCP1 CCT1 CCTA"	"Homo sapiens (Human)"	"556"
"P20338"	"RAB4A_HUMAN"	"reviewed"	"Ras-related protein Rab-4A"	"RAB4A RAB4"	"Homo sapiens (Human)"	"218"
"P17661"	"DESM_HUMAN"	"reviewed"	"Desmin"	"DES"	"Homo sapiens (Human)"	"470"
"P20073"	"ANXA7_HUMAN"	"reviewed"	"Annexin A7 (Annexin VII) (Annexin-7) (Synexin)"	"ANXA7 ANX7 SNX OK/SW-cl.95"	"Homo sapiens (Human)"	"488"
"P17540"	"KCRS_HUMAN"	"reviewed"	"Creatine kinase S-type, mitochondrial (EC 2.7.3.2) (Basic-type mitochondrial creatine kinase) (Mib-CK) (Sarcomeric mitochondrial creatine kinase) (S-MtCK)"	"CKMT2"	"Homo sapiens (Human)"	"419"
"P17066"	"HSP76_HUMAN"	"reviewed"	"Heat shock 70 kDa protein 6 (Heat shock 70 kDa protein B')"	"HSPA6 HSP70B'"	"Homo sapiens (Human)"	"643"
"P22087"	"FBRL_HUMAN"	"reviewed"	"rRNA 2'-O-methyltransferase fibrillarin (EC 2.1.1.-) (34 kDa nucleolar scleroderma antigen) (Histone-glutamine methyltransferase) (U6 snRNA 2'-O-methyltransferase fibrillarin)"	"FBL FIB1 FLRN"	"Homo sapiens (Human)"	"321"
"P21695"	"GPDA_HUMAN"	"reviewed"	"Glycerol-3-phosphate dehydrogenase [NAD(+)], cytoplasmic (GPD-C) (GPDH-C) (EC 1.1.1.8)"	"GPD1"	"Homo sapiens (Human)"	"349"
"P21333"	"FLNA_HUMAN"	"reviewed"	"Filamin-A (FLN-A) (Actin-binding protein 280) (ABP-280) (Alpha-filamin) (Endothelial actin-binding protein) (Filamin-1) (Non-muscle filamin)"	"FLNA FLN FLN1"	"Homo sapiens (Human)"	"2647"
"P20674"	"COX5A_HUMAN"	"reviewed"	"Cytochrome c oxidase subunit 5A, mitochondrial (Cytochrome c oxidase polypeptide Va)"	"COX5A"	"Homo sapiens (Human)"	"150"
"P17844"	"DDX5_HUMAN"	"reviewed"	"Probable ATP-dependent RNA helicase DDX5 (EC 3.6.4.13) (DEAD box protein 5) (RNA helicase p68)"	"DDX5 G17P1 HELR HLR1"	"Homo sapiens (Human)"	"614"
"P20930"	"FILA_HUMAN"	"reviewed"	"Filaggrin"	"FLG"	"Homo sapiens (Human)"	"4061"
"P23528"	"COF1_HUMAN"	"reviewed"	"Cofilin-1 (18 kDa phosphoprotein) (p18) (Cofilin, non-muscle isoform)"	"CFL1 CFL"	"Homo sapiens (Human)"	"166"
"Q8IV01"	"SYT12_HUMAN"	"reviewed"	"Synaptotagmin-12 (Synaptotagmin XII) (SytXII)"	"SYT12"	"Homo sapiens (Human)"	"421"
"P25311"	"ZA2G_HUMAN"	"reviewed"	"Zinc-alpha-2-glycoprotein (Zn-alpha-2-GP) (Zn-alpha-2-glycoprotein)"	"AZGP1 ZAG ZNGP1"	"Homo sapiens (Human)"	"298"
"P26368"	"U2AF2_HUMAN"	"reviewed"	"Splicing factor U2AF 65 kDa subunit (U2 auxiliary factor 65 kDa subunit) (hU2AF(65)) (hU2AF65) (U2 snRNP auxiliary factor large subunit)"	"U2AF2 U2AF65"	"Homo sapiens (Human)"	"475"
"P23396"	"RS3_HUMAN"	"reviewed"	"40S ribosomal protein S3 (EC 4.2.99.18) (Small ribosomal subunit protein uS3)"	"RPS3 OK/SW-cl.26"	"Homo sapiens (Human)"	"243"
"P24752"	"THIL_HUMAN"	"reviewed"	"Acetyl-CoA acetyltransferase, mitochondrial (EC 2.3.1.9) (Acetoacetyl-CoA thiolase) (T2)"	"ACAT1 ACAT MAT"	"Homo sapiens (Human)"	"427"
"P22735"	"TGM1_HUMAN"	"reviewed"	"Protein-glutamine gamma-glutamyltransferase K (EC 2.3.2.13) (Epidermal TGase) (Transglutaminase K) (TG(K)) (TGK) (TGase K) (Transglutaminase-1) (TGase-1)"	"TGM1 KTG"	"Homo sapiens (Human)"	"817"
"P25398"	"RS12_HUMAN"	"reviewed"	"40S ribosomal protein S12 (Small ribosomal subunit protein eS12)"	"RPS12"	"Homo sapiens (Human)"	"132"
"P25325"	"THTM_HUMAN"	"reviewed"	"3-mercaptopyruvate sulfurtransferase (MST) (EC 2.8.1.2)"	"MPST TST2"	"Homo sapiens (Human)"	"297"
"P24928"	"RPB1_HUMAN"	"reviewed"	"DNA-directed RNA polymerase II subunit RPB1 (RNA polymerase II subunit B1) (EC 2.7.7.6) (DNA-directed RNA polymerase II subunit A) (DNA-directed RNA polymerase III largest subunit) (RNA-directed RNA polymerase II subunit RPB1) (EC 2.7.7.48)"	"POLR2A POLR2"	"Homo sapiens (Human)"	"1970"
"P22314"	"UBA1_HUMAN"	"reviewed"	"Ubiquitin-like modifier-activating enzyme 1 (EC 6.2.1.45) (Protein A1S9) (Ubiquitin-activating enzyme E1)"	"UBA1 A1S9T UBE1"	"Homo sapiens (Human)"	"1058"
"P23246"	"SFPQ_HUMAN"	"reviewed"	"Splicing factor, proline- and glutamine-rich (100 kDa DNA-pairing protein) (hPOMp100) (DNA-binding p52/p100 complex, 100 kDa subunit) (Polypyrimidine tract-binding protein-associated-splicing factor) (PSF) (PTB-associated-splicing factor)"	"SFPQ PSF"	"Homo sapiens (Human)"	"707"
"P26639"	"SYTC_HUMAN"	"reviewed"	"Threonine--tRNA ligase 1, cytoplasmic (EC 6.1.1.3) (Threonyl-tRNA synthetase) (ThrRS) (Threonyl-tRNA synthetase 1)"	"TARS1 TARS"	"Homo sapiens (Human)"	"723"
"P22681"	"CBL_HUMAN"	"reviewed"	"E3 ubiquitin-protein ligase CBL (EC 2.3.2.27) (Casitas B-lineage lymphoma proto-oncogene) (Proto-oncogene c-Cbl) (RING finger protein 55) (RING-type E3 ubiquitin transferase CBL) (Signal transduction protein CBL)"	"CBL CBL2 RNF55"	"Homo sapiens (Human)"	"906"
"P25685"	"DNJB1_HUMAN"	"reviewed"	"DnaJ homolog subfamily B member 1 (DnaJ protein homolog 1) (Heat shock 40 kDa protein 1) (HSP40) (Heat shock protein 40) (Human DnaJ protein 1) (hDj-1)"	"DNAJB1 DNAJ1 HDJ1 HSPF1"	"Homo sapiens (Human)"	"340"
"P24534"	"EF1B_HUMAN"	"reviewed"	"Elongation factor 1-beta (EF-1-beta)"	"EEF1B2 EEF1B EF1B"	"Homo sapiens (Human)"	"225"
"P25705"	"ATPA_HUMAN"	"reviewed"	"ATP synthase subunit alpha, mitochondrial (ATP synthase F1 subunit alpha)"	"ATP5F1A ATP5A ATP5A1 ATP5AL2 ATPM"	"Homo sapiens (Human)"	"553"
"P22570"	"ADRO_HUMAN"	"reviewed"	"NADPH:adrenodoxin oxidoreductase, mitochondrial (AR) (Adrenodoxin reductase) (EC 1.18.1.6) (Ferredoxin--NADP(+) reductase) (Ferredoxin reductase)"	"FDXR ADXR"	"Homo sapiens (Human)"	"491"
"P23526"	"SAHH_HUMAN"	"reviewed"	"Adenosylhomocysteinase (AdoHcyase) (EC 3.3.1.1) (S-adenosyl-L-homocysteine hydrolase)"	"AHCY SAHH"	"Homo sapiens (Human)"	"432"
"P26640"	"SYVC_HUMAN"	"reviewed"	"Valine--tRNA ligase (EC 6.1.1.9) (Protein G7a) (Valyl-tRNA synthetase) (ValRS)"	"VARS1 G7A VARS VARS2"	"Homo sapiens (Human)"	"1264"
"P23381"	"SYWC_HUMAN"	"reviewed"	"Tryptophan--tRNA ligase, cytoplasmic (EC 6.1.1.2) (Interferon-induced protein 53) (IFP53) (Tryptophanyl-tRNA synthetase) (TrpRS) (hWRS) [Cleaved into: T1-TrpRS; T2-TrpRS]"	"WARS1 IFI53 WARS WRS"	"Homo sapiens (Human)"	"471"
"P26196"	"DDX6_HUMAN"	"reviewed"	"Probable ATP-dependent RNA helicase DDX6 (EC 3.6.4.13) (ATP-dependent RNA helicase p54) (DEAD box protein 6) (Oncogene RCK)"	"DDX6 HLR2 RCK"	"Homo sapiens (Human)"	"483"
"P25786"	"PSA1_HUMAN"	"reviewed"	"Proteasome subunit alpha type-1 (EC 3.4.25.1) (30 kDa prosomal protein) (PROS-30) (Macropain subunit C2) (Multicatalytic endopeptidase complex subunit C2) (Proteasome component C2) (Proteasome nu chain)"	"PSMA1 HC2 NU PROS30 PSC2"	"Homo sapiens (Human)"	"263"
"P23588"	"IF4B_HUMAN"	"reviewed"	"Eukaryotic translation initiation factor 4B (eIF-4B)"	"EIF4B"	"Homo sapiens (Human)"	"611"
"P22392"	"NDKB_HUMAN"	"reviewed"	"Nucleoside diphosphate kinase B (NDK B) (NDP kinase B) (EC 2.7.4.6) (C-myc purine-binding transcription factor PUF) (Histidine protein kinase NDKB) (EC 2.7.13.3) (nm23-H2)"	"NME2 NM23B"	"Homo sapiens (Human)"	"152"
"P22695"	"QCR2_HUMAN"	"reviewed"	"Cytochrome b-c1 complex subunit 2, mitochondrial (Complex III subunit 2) (Core protein II) (Ubiquinol-cytochrome-c reductase complex core protein 2)"	"UQCRC2"	"Homo sapiens (Human)"	"453"
"P26038"	"MOES_HUMAN"	"reviewed"	"Moesin (Membrane-organizing extension spike protein)"	"MSN"	"Homo sapiens (Human)"	"577"
"P25787"	"PSA2_HUMAN"	"reviewed"	"Proteasome subunit alpha type-2 (EC 3.4.25.1) (Macropain subunit C3) (Multicatalytic endopeptidase complex subunit C3) (Proteasome component C3)"	"PSMA2 HC3 PSC3"	"Homo sapiens (Human)"	"234"
"P26440"	"IVD_HUMAN"	"reviewed"	"Isovaleryl-CoA dehydrogenase, mitochondrial (IVD) (EC 1.3.8.4) (Butyryl-CoA dehydrogenase) (EC 1.3.8.1)"	"IVD"	"Homo sapiens (Human)"	"426"
"P23368"	"MAOM_HUMAN"	"reviewed"	"NAD-dependent malic enzyme, mitochondrial (NAD-ME) (EC 1.1.1.38) (Malic enzyme 2)"	"ME2"	"Homo sapiens (Human)"	"584"
"P25205"	"MCM3_HUMAN"	"reviewed"	"DNA replication licensing factor MCM3 (EC 3.6.4.12) (DNA polymerase alpha holoenzyme-associated protein P1) (P1-MCM3) (RLF subunit beta) (p102)"	"MCM3"	"Homo sapiens (Human)"	"808"
"P23284"	"PPIB_HUMAN"	"reviewed"	"Peptidyl-prolyl cis-trans isomerase B (PPIase B) (EC 5.2.1.8) (CYP-S1) (Cyclophilin B) (Rotamase B) (S-cyclophilin) (SCYLP)"	"PPIB CYPB"	"Homo sapiens (Human)"	"216"
"P25815"	"S100P_HUMAN"	"reviewed"	"Protein S100-P (Migration-inducing gene 9 protein) (MIG9) (Protein S100-E) (S100 calcium-binding protein P)"	"S100P S100E"	"Homo sapiens (Human)"	"95"
"P22234"	"PUR6_HUMAN"	"reviewed"	"Multifunctional protein ADE2 [Includes: Phosphoribosylaminoimidazole-succinocarboxamide synthase (EC 6.3.2.6) (SAICAR synthetase); Phosphoribosylaminoimidazole carboxylase (EC 4.1.1.21) (AIR carboxylase) (AIRC)]"	"PAICS ADE2 AIRC PAIS"	"Homo sapiens (Human)"	"425"
"P25788"	"PSA3_HUMAN"	"reviewed"	"Proteasome subunit alpha type-3 (EC 3.4.25.1) (Macropain subunit C8) (Multicatalytic endopeptidase complex subunit C8) (Proteasome component C8)"	"PSMA3 HC8 PSC8"	"Homo sapiens (Human)"	"255"
"P26599"	"PTBP1_HUMAN"	"reviewed"	"Polypyrimidine tract-binding protein 1 (PTB) (57 kDa RNA-binding protein PPTB-1) (Heterogeneous nuclear ribonucleoprotein I) (hnRNP I)"	"PTBP1 PTB"	"Homo sapiens (Human)"	"531"
"P24666"	"PPAC_HUMAN"	"reviewed"	"Low molecular weight phosphotyrosine protein phosphatase (LMW-PTP) (LMW-PTPase) (EC 3.1.3.48) (Adipocyte acid phosphatase) (Low molecular weight cytosolic acid phosphatase) (EC 3.1.3.2) (Red cell acid phosphatase 1)"	"ACP1"	"Homo sapiens (Human)"	"158"
"P25789"	"PSA4_HUMAN"	"reviewed"	"Proteasome subunit alpha type-4 (EC 3.4.25.1) (Macropain subunit C9) (Multicatalytic endopeptidase complex subunit C9) (Proteasome component C9) (Proteasome subunit L)"	"PSMA4 HC9 PSC9"	"Homo sapiens (Human)"	"261"
"P23921"	"RIR1_HUMAN"	"reviewed"	"Ribonucleoside-diphosphate reductase large subunit (EC 1.17.4.1) (Ribonucleoside-diphosphate reductase subunit M1) (Ribonucleotide reductase large subunit)"	"RRM1 RR1"	"Homo sapiens (Human)"	"792"
"P23434"	"GCSH_HUMAN"	"reviewed"	"Glycine cleavage system H protein, mitochondrial (Lipoic acid-containing protein)"	"GCSH"	"Homo sapiens (Human)"	"173"
"P22694"	"KAPCB_HUMAN"	"reviewed"	"cAMP-dependent protein kinase catalytic subunit beta (PKA C-beta) (EC 2.7.11.11)"	"PRKACB"	"Homo sapiens (Human)"	"351"
"P26373"	"RL13_HUMAN"	"reviewed"	"60S ribosomal protein L13 (Breast basic conserved protein 1) (Large ribosomal subunit protein eL13)"	"RPL13 BBC1 OK/SW-cl.46"	"Homo sapiens (Human)"	"211"
"P22626"	"ROA2_HUMAN"	"reviewed"	"Heterogeneous nuclear ribonucleoproteins A2/B1 (hnRNP A2/B1)"	"HNRNPA2B1 HNRPA2B1"	"Homo sapiens (Human)"	"353"
"P23919"	"KTHY_HUMAN"	"reviewed"	"Thymidylate kinase (EC 2.7.4.9) (dTMP kinase)"	"DTYMK CDC8 TMPK TYMK"	"Homo sapiens (Human)"	"212"
"P22760"	"AAAD_HUMAN"	"reviewed"	"Arylacetamide deacetylase (EC 3.1.1.3)"	"AADAC DAC"	"Homo sapiens (Human)"	"399"
"P26583"	"HMGB2_HUMAN"	"reviewed"	"High mobility group protein B2 (High mobility group protein 2) (HMG-2)"	"HMGB2 HMG2"	"Homo sapiens (Human)"	"209"
"P24539"	"AT5F1_HUMAN"	"reviewed"	"ATP synthase F(0) complex subunit B1, mitochondrial (ATP synthase peripheral stalk-membrane subunit b) (ATP synthase proton-transporting mitochondrial F(0) complex subunit B1) (ATP synthase subunit b) (ATPase subunit b)"	"ATP5PB ATP5F1"	"Homo sapiens (Human)"	"256"
"P22830"	"HEMH_HUMAN"	"reviewed"	"Ferrochelatase, mitochondrial (EC 4.99.1.1) (Heme synthase) (Protoheme ferro-lyase)"	"FECH"	"Homo sapiens (Human)"	"423"
"P23378"	"GCSP_HUMAN"	"reviewed"	"Glycine dehydrogenase (decarboxylating), mitochondrial (EC 1.4.4.2) (Glycine cleavage system P protein) (Glycine decarboxylase) (Glycine dehydrogenase (aminomethyl-transferring))"	"GLDC GCSP"	"Homo sapiens (Human)"	"1020"
"P23786"	"CPT2_HUMAN"	"reviewed"	"Carnitine O-palmitoyltransferase 2, mitochondrial (EC 2.3.1.21) (Carnitine palmitoyltransferase II) (CPT II)"	"CPT2 CPT1"	"Homo sapiens (Human)"	"658"
"P26358"	"DNMT1_HUMAN"	"reviewed"	"DNA (cytosine-5)-methyltransferase 1 (Dnmt1) (EC 2.1.1.37) (CXXC-type zinc finger protein 9) (DNA methyltransferase HsaI) (DNA MTase HsaI) (M.HsaI) (MCMT)"	"DNMT1 AIM CXXC9 DNMT"	"Homo sapiens (Human)"	"1616"
"P27797"	"CALR_HUMAN"	"reviewed"	"Calreticulin (CRP55) (Calregulin) (Endoplasmic reticulum resident protein 60) (ERp60) (HACBP) (grp60)"	"CALR CRTC"	"Homo sapiens (Human)"	"417"
"P06881"	"CALCA_HUMAN"	"reviewed"	"Calcitonin gene-related peptide 1 (Alpha-type CGRP) (Calcitonin gene-related peptide I) (CGRP-I)"	"CALCA CALC1"	"Homo sapiens (Human)"	"128"
"P27708"	"PYR1_HUMAN"	"reviewed"	"CAD protein [Includes: Glutamine-dependent carbamoyl-phosphate synthase (EC 6.3.5.5); Aspartate carbamoyltransferase (EC 2.1.3.2); Dihydroorotase (EC 3.5.2.3)]"	"CAD"	"Homo sapiens (Human)"	"2225"
"P30048"	"PRDX3_HUMAN"	"reviewed"	"Thioredoxin-dependent peroxide reductase, mitochondrial (EC 1.11.1.24) (Antioxidant protein 1) (AOP-1) (HBC189) (Peroxiredoxin III) (Prx-III) (Peroxiredoxin-3) (Protein MER5 homolog) (Thioredoxin-dependent peroxiredoxin 3)"	"PRDX3 AOP1"	"Homo sapiens (Human)"	"256"
"P29084"	"T2EB_HUMAN"	"reviewed"	"Transcription initiation factor IIE subunit beta (TFIIE-beta) (General transcription factor IIE subunit 2)"	"GTF2E2 TF2E2"	"Homo sapiens (Human)"	"291"
"P30520"	"PURA2_HUMAN"	"reviewed"	"Adenylosuccinate synthetase isozyme 2 (AMPSase 2) (AdSS 2) (EC 6.3.4.4) (Adenylosuccinate synthetase, acidic isozyme) (Adenylosuccinate synthetase, liver isozyme) (L-type adenylosuccinate synthetase) (IMP--aspartate ligase 2)"	"ADSS2 ADSS"	"Homo sapiens (Human)"	"456"
"P26678"	"PPLA_HUMAN"	"reviewed"	"Cardiac phospholamban (PLB)"	"PLN PLB"	"Homo sapiens (Human)"	"52"
"P29083"	"T2EA_HUMAN"	"reviewed"	"General transcription factor IIE subunit 1 (General transcription factor IIE 56 kDa subunit) (Transcription initiation factor IIE subunit alpha) (TFIIE-alpha)"	"GTF2E1 TF2E1"	"Homo sapiens (Human)"	"439"
"P27695"	"APEX1_HUMAN"	"reviewed"	"DNA-(apurinic or apyrimidinic site) endonuclease (EC 3.1.-.-) (APEX nuclease) (APEN) (Apurinic-apyrimidinic endonuclease 1) (AP endonuclease 1) (APE-1) (REF-1) (Redox factor-1) [Cleaved into: DNA-(apurinic or apyrimidinic site) endonuclease, mitochondrial]"	"APEX1 APE APE1 APEX APX HAP1 REF1"	"Homo sapiens (Human)"	"318"
"P29692"	"EF1D_HUMAN"	"reviewed"	"Elongation factor 1-delta (EF-1-delta) (Antigen NY-CO-4)"	"EEF1D EF1D"	"Homo sapiens (Human)"	"281"
"P27482"	"CALL3_HUMAN"	"reviewed"	"Calmodulin-like protein 3 (CaM-like protein) (CLP) (Calmodulin-related protein NB-1)"	"CALML3"	"Homo sapiens (Human)"	"149"
"P27348"	"1433T_HUMAN"	"reviewed"	"14-3-3 protein theta (14-3-3 protein T-cell) (14-3-3 protein tau) (Protein HS1)"	"YWHAQ"	"Homo sapiens (Human)"	"245"
"P30043"	"BLVRB_HUMAN"	"reviewed"	"Flavin reductase (NADPH) (FR) (EC 1.5.1.30) (Biliverdin reductase B) (BVR-B) (EC 1.3.1.24) (Biliverdin-IX beta-reductase) (Green heme-binding protein) (GHBP) (NADPH-dependent diaphorase) (NADPH-flavin reductase) (FLR)"	"BLVRB FLR"	"Homo sapiens (Human)"	"206"
"P28288"	"ABCD3_HUMAN"	"reviewed"	"ATP-binding cassette sub-family D member 3 (70 kDa peroxisomal membrane protein) (PMP70)"	"ABCD3 PMP70 PXMP1"	"Homo sapiens (Human)"	"659"
"P29508"	"SPB3_HUMAN"	"reviewed"	"Serpin B3 (Protein T4-A) (Squamous cell carcinoma antigen 1) (SCCA-1)"	"SERPINB3 SCCA SCCA1"	"Homo sapiens (Human)"	"390"
"P28370"	"SMCA1_HUMAN"	"reviewed"	"Probable global transcription activator SNF2L1 (EC 3.6.4.-) (ATP-dependent helicase SMARCA1) (Nucleosome-remodeling factor subunit SNF2L) (SWI/SNF-related matrix-associated actin-dependent regulator of chromatin subfamily A member 1)"	"SMARCA1 SNF2L SNF2L1"	"Homo sapiens (Human)"	"1054"
"P28838"	"AMPL_HUMAN"	"reviewed"	"Cytosol aminopeptidase (EC 3.4.11.1) (Leucine aminopeptidase 3) (LAP-3) (Leucyl aminopeptidase) (Peptidase S) (Proline aminopeptidase) (EC 3.4.11.5) (Prolyl aminopeptidase)"	"LAP3 LAPEP PEPS"	"Homo sapiens (Human)"	"519"
"P30988"	"CALCR_HUMAN"	"reviewed"	"Calcitonin receptor (CT-R)"	"CALCR"	"Homo sapiens (Human)"	"474"
"P27824"	"CALX_HUMAN"	"reviewed"	"Calnexin (IP90) (Major histocompatibility complex class I antigen-binding protein p88) (p90)"	"CANX"	"Homo sapiens (Human)"	"592"
"P27694"	"RFA1_HUMAN"	"reviewed"	"Replication protein A 70 kDa DNA-binding subunit (RP-A p70) (Replication factor A protein 1) (RF-A protein 1) (Single-stranded DNA-binding protein) [Cleaved into: Replication protein A 70 kDa DNA-binding subunit, N-terminally processed]"	"RPA1 REPA1 RPA70"	"Homo sapiens (Human)"	"616"
"P28074"	"PSB5_HUMAN"	"reviewed"	"Proteasome subunit beta type-5 (EC 3.4.25.1) (Macropain epsilon chain) (Multicatalytic endopeptidase complex epsilon chain) (Proteasome chain 6) (Proteasome epsilon chain) (Proteasome subunit MB1) (Proteasome subunit X)"	"PSMB5 LMPX MB1 X"	"Homo sapiens (Human)"	"263"
"P30041"	"PRDX6_HUMAN"	"reviewed"	"Peroxiredoxin-6 (EC 1.11.1.27) (1-Cys peroxiredoxin) (1-Cys PRX) (24 kDa protein) (Acidic calcium-independent phospholipase A2) (aiPLA2) (EC 3.1.1.4) (Antioxidant protein 2) (Glutathione-dependent peroxiredoxin) (Liver 2D page spot 40) (Non-selenium glutathione peroxidase) (NSGPx) (Red blood cells page spot 12)"	"PRDX6 AOP2 KIAA0106"	"Homo sapiens (Human)"	"224"
"P28331"	"NDUS1_HUMAN"	"reviewed"	"NADH-ubiquinone oxidoreductase 75 kDa subunit, mitochondrial (EC 7.1.1.2) (Complex I-75kD) (CI-75kD)"	"NDUFS1"	"Homo sapiens (Human)"	"727"
"P30101"	"PDIA3_HUMAN"	"reviewed"	"Protein disulfide-isomerase A3 (EC 5.3.4.1) (58 kDa glucose-regulated protein) (58 kDa microsomal protein) (p58) (Disulfide isomerase ER-60) (Endoplasmic reticulum resident protein 57) (ER protein 57) (ERp57) (Endoplasmic reticulum resident protein 60) (ER protein 60) (ERp60)"	"PDIA3 ERP57 ERP60 GRP58"	"Homo sapiens (Human)"	"505"
"P28482"	"MK01_HUMAN"	"reviewed"	"Mitogen-activated protein kinase 1 (MAP kinase 1) (MAPK 1) (EC 2.7.11.24) (ERT1) (Extracellular signal-regulated kinase 2) (ERK-2) (MAP kinase isoform p42) (p42-MAPK) (Mitogen-activated protein kinase 2) (MAP kinase 2) (MAPK 2)"	"MAPK1 ERK2 PRKM1 PRKM2"	"Homo sapiens (Human)"	"360"
"P28072"	"PSB6_HUMAN"	"reviewed"	"Proteasome subunit beta type-6 (EC 3.4.25.1) (Macropain delta chain) (Multicatalytic endopeptidase complex delta chain) (Proteasome delta chain) (Proteasome subunit Y)"	"PSMB6 LMPY Y"	"Homo sapiens (Human)"	"239"
"P28340"	"DPOD1_HUMAN"	"reviewed"	"DNA polymerase delta catalytic subunit (EC 2.7.7.7) (3'-5' exodeoxyribonuclease) (EC 3.1.11.-) (DNA polymerase subunit delta p125)"	"POLD1 POLD"	"Homo sapiens (Human)"	"1107"
"P27815"	"PDE4A_HUMAN"	"reviewed"	"cAMP-specific 3',5'-cyclic phosphodiesterase 4A (EC 3.1.4.53) (DPDE2) (PDE46)"	"PDE4A DPDE2"	"Homo sapiens (Human)"	"886"
"P29558"	"RBMS1_HUMAN"	"reviewed"	"RNA-binding motif, single-stranded-interacting protein 1 (Single-stranded DNA-binding protein MSSP-1) (Suppressor of CDC2 with RNA-binding motif 2)"	"RBMS1 C2orf12 MSSP MSSP1 SCR2"	"Homo sapiens (Human)"	"406"
"P30405"	"PPIF_HUMAN"	"reviewed"	"Peptidyl-prolyl cis-trans isomerase F, mitochondrial (PPIase F) (EC 5.2.1.8) (Cyclophilin D) (CyP-D) (CypD) (Cyclophilin F) (Mitochondrial cyclophilin) (CyP-M) (Rotamase F)"	"PPIF CYP3"	"Homo sapiens (Human)"	"207"
"P30044"	"PRDX5_HUMAN"	"reviewed"	"Peroxiredoxin-5, mitochondrial (EC 1.11.1.24) (Alu corepressor 1) (Antioxidant enzyme B166) (AOEB166) (Liver tissue 2D-page spot 71B) (PLP) (Peroxiredoxin V) (Prx-V) (Peroxisomal antioxidant enzyme) (TPx type VI) (Thioredoxin peroxidase PMP20) (Thioredoxin-dependent peroxiredoxin 5)"	"PRDX5 ACR1 SBBI10"	"Homo sapiens (Human)"	"214"
"P30086"	"PEBP1_HUMAN"	"reviewed"	"Phosphatidylethanolamine-binding protein 1 (PEBP-1) (HCNPpp) (Neuropolypeptide h3) (Prostatic-binding protein) (Raf kinase inhibitor protein) (RKIP) [Cleaved into: Hippocampal cholinergic neurostimulating peptide (HCNP)]"	"PEBP1 PBP PEBP"	"Homo sapiens (Human)"	"187"
"P30419"	"NMT1_HUMAN"	"reviewed"	"Glycylpeptide N-tetradecanoyltransferase 1 (EC 2.3.1.97) (Myristoyl-CoA:protein N-myristoyltransferase 1) (NMT 1) (Type I N-myristoyltransferase) (Peptide N-myristoyltransferase 1)"	"NMT1 NMT"	"Homo sapiens (Human)"	"496"
"P30038"	"AL4A1_HUMAN"	"reviewed"	"Delta-1-pyrroline-5-carboxylate dehydrogenase, mitochondrial (P5C dehydrogenase) (EC 1.2.1.88) (Aldehyde dehydrogenase family 4 member A1) (L-glutamate gamma-semialdehyde dehydrogenase)"	"ALDH4A1 ALDH4 P5CDH"	"Homo sapiens (Human)"	"563"
"P30740"	"ILEU_HUMAN"	"reviewed"	"Leukocyte elastase inhibitor (LEI) (Monocyte/neutrophil elastase inhibitor) (EI) (M/NEI) (Peptidase inhibitor 2) (PI-2) (Serpin B1)"	"SERPINB1 ELANH2 MNEI PI2"	"Homo sapiens (Human)"	"379"
"P30837"	"AL1B1_HUMAN"	"reviewed"	"Aldehyde dehydrogenase X, mitochondrial (EC 1.2.1.3) (Aldehyde dehydrogenase 5) (Aldehyde dehydrogenase family 1 member B1)"	"ALDH1B1 ALDH5 ALDHX"	"Homo sapiens (Human)"	"517"
"P30085"	"KCY_HUMAN"	"reviewed"	"UMP-CMP kinase (EC 2.7.4.14) (Deoxycytidylate kinase) (CK) (dCMP kinase) (Nucleoside-diphosphate kinase) (EC 2.7.4.6) (Uridine monophosphate/cytidine monophosphate kinase) (UMP/CMP kinase) (UMP/CMPK)"	"CMPK1 CMK CMPK UCK UMK UMPK"	"Homo sapiens (Human)"	"196"
"P27361"	"MK03_HUMAN"	"reviewed"	"Mitogen-activated protein kinase 3 (MAP kinase 3) (MAPK 3) (EC 2.7.11.24) (ERT2) (Extracellular signal-regulated kinase 1) (ERK-1) (Insulin-stimulated MAP2 kinase) (MAP kinase isoform p44) (p44-MAPK) (Microtubule-associated protein 2 kinase) (p44-ERK1)"	"MAPK3 ERK1 PRKM3"	"Homo sapiens (Human)"	"379"
"P30153"	"2AAA_HUMAN"	"reviewed"	"Serine/threonine-protein phosphatase 2A 65 kDa regulatory subunit A alpha isoform (Medium tumor antigen-associated 61 kDa protein) (PP2A subunit A isoform PR65-alpha) (PP2A subunit A isoform R1-alpha)"	"PPP2R1A"	"Homo sapiens (Human)"	"589"
"P29373"	"RABP2_HUMAN"	"reviewed"	"Cellular retinoic acid-binding protein 2 (Cellular retinoic acid-binding protein II) (CRABP-II)"	"CRABP2"	"Homo sapiens (Human)"	"138"
"P28066"	"PSA5_HUMAN"	"reviewed"	"Proteasome subunit alpha type-5 (EC 3.4.25.1) (Macropain zeta chain) (Multicatalytic endopeptidase complex zeta chain) (Proteasome zeta chain)"	"PSMA5"	"Homo sapiens (Human)"	"241"
"P30050"	"RL12_HUMAN"	"reviewed"	"60S ribosomal protein L12 (Large ribosomal subunit protein uL11)"	"RPL12"	"Homo sapiens (Human)"	"165"
"P30626"	"SORCN_HUMAN"	"reviewed"	"Sorcin (22 kDa protein) (CP-22) (CP22) (V19)"	"SRI"	"Homo sapiens (Human)"	"198"
"P30566"	"PUR8_HUMAN"	"reviewed"	"Adenylosuccinate lyase (ADSL) (ASL) (EC 4.3.2.2) (Adenylosuccinase) (ASase)"	"ADSL AMPS"	"Homo sapiens (Human)"	"484"
"P29401"	"TKT_HUMAN"	"reviewed"	"Transketolase (TK) (EC 2.2.1.1)"	"TKT"	"Homo sapiens (Human)"	"623"
"P27635"	"RL10_HUMAN"	"reviewed"	"60S ribosomal protein L10 (Laminin receptor homolog) (Large ribosomal subunit protein uL16) (Protein QM) (Ribosomal protein L10) (Tumor suppressor QM)"	"RPL10 DXS648E QM"	"Homo sapiens (Human)"	"214"
"P27816"	"MAP4_HUMAN"	"reviewed"	"Microtubule-associated protein 4 (MAP-4)"	"MAP4"	"Homo sapiens (Human)"	"1152"
"P29966"	"MARCS_HUMAN"	"reviewed"	"Myristoylated alanine-rich C-kinase substrate (MARCKS) (Protein kinase C substrate, 80 kDa protein, light chain) (80K-L protein) (PKCSL)"	"MARCKS MACS PRKCSL"	"Homo sapiens (Human)"	"332"
"P27144"	"KAD4_HUMAN"	"reviewed"	"Adenylate kinase 4, mitochondrial (AK 4) (EC 2.7.4.10) (EC 2.7.4.6) (Adenylate kinase 3-like) (GTP:AMP phosphotransferase AK4)"	"AK4 AK3 AK3L1"	"Homo sapiens (Human)"	"223"
"P26641"	"EF1G_HUMAN"	"reviewed"	"Elongation factor 1-gamma (EF-1-gamma) (eEF-1B gamma)"	"EEF1G EF1G PRO1608"	"Homo sapiens (Human)"	"437"
"P30040"	"ERP29_HUMAN"	"reviewed"	"Endoplasmic reticulum resident protein 29 (ERp29) (Endoplasmic reticulum resident protein 28) (ERp28) (Endoplasmic reticulum resident protein 31) (ERp31)"	"ERP29 C12orf8 ERP28"	"Homo sapiens (Human)"	"261"
"P30084"	"ECHM_HUMAN"	"reviewed"	"Enoyl-CoA hydratase, mitochondrial (EC 4.2.1.17) (Enoyl-CoA hydratase 1) (Short-chain enoyl-CoA hydratase) (SCEH)"	"ECHS1"	"Homo sapiens (Human)"	"290"
"P35606"	"COPB2_HUMAN"	"reviewed"	"Coatomer subunit beta' (Beta'-coat protein) (Beta'-COP) (p102)"	"COPB2"	"Homo sapiens (Human)"	"906"
"P31947"	"1433S_HUMAN"	"reviewed"	"14-3-3 protein sigma (Epithelial cell marker protein 1) (Stratifin)"	"SFN HME1"	"Homo sapiens (Human)"	"248"
"P31944"	"CASPE_HUMAN"	"reviewed"	"Caspase-14 (CASP-14) (EC 3.4.22.-) [Cleaved into: Caspase-14 subunit p17, mature form; Caspase-14 subunit p10, mature form; Caspase-14 subunit p20, intermediate form; Caspase-14 subunit p8, intermediate form]"	"CASP14"	"Homo sapiens (Human)"	"242"
"P31483"	"TIA1_HUMAN"	"reviewed"	"Nucleolysin TIA-1 isoform p40 (RNA-binding protein TIA-1) (T-cell-restricted intracellular antigen-1) (TIA-1) (p40-TIA-1)"	"TIA1"	"Homo sapiens (Human)"	"386"
"P35030"	"TRY3_HUMAN"	"reviewed"	"Trypsin-3 (EC 3.4.21.4) (Brain trypsinogen) (Mesotrypsin) (Mesotrypsinogen) (Serine protease 3) (Serine protease 4) (Trypsin III) (Trypsin IV)"	"PRSS3 PRSS4 TRY3 TRY4"	"Homo sapiens (Human)"	"304"
"P35249"	"RFC4_HUMAN"	"reviewed"	"Replication factor C subunit 4 (Activator 1 37 kDa subunit) (A1 37 kDa subunit) (Activator 1 subunit 4) (Replication factor C 37 kDa subunit) (RF-C 37 kDa subunit) (RFC37)"	"RFC4"	"Homo sapiens (Human)"	"363"
